{"metric":{"denominator":{"field":"denominator","op":"sum","source":"bottom","unit":"万元"},"numerator":{"field":"numerator","op":"sum","source":"top","unit":"元"},"op":"ratio","places":4,"rounding":"HALF_UP"},"metric_id":"metric","schema_version":"1","sources":{"bottom":{"file_id":"data","header_row":1,"rows":[2,2],"sheet":"@csv"},"top":{"file_id":"data","header_row":1,"rows":[2,2],"sheet":"@csv"}}}