{"metric":{"denominator":{"filter":{"eq":"YES","field":"included"},"op":"count","source":"bottom"},"numerator":{"filter":{"eq":"YES","field":"completed"},"op":"count","source":"top"},"op":"ratio","places":4,"rounding":"HALF_UP"},"metric_id":"metric","schema_version":"1","sources":{"bottom":{"file_id":"data","header_row":1,"rows":[2,5],"sheet":"@csv"},"top":{"file_id":"data","header_row":1,"rows":[2,5],"sheet":"@csv"}}}